<?xml version="1.0" encoding="UTF-8"?>
<!DOCTYPE cd SYSTEM "songs.dtd">
<cd titulo="">
<fecha dia="a" mes="a" anio="a"></fecha>
    <songs>
        <song duracion="3:20" anio="1978">
            <titulo></titulo>
            <compositores>
                <compositor>
                    <nombre></nombre>
                    <apellido></apellido>
                </compositor>
            </compositores>
            <productores>
                <productor>
                    <nombre></nombre>
                    <apellido></apellido>
                </productor>
            </productores>
            <publisher></publisher>
            <artistas>
                <artista></artista>
            </artistas>
        </song>
    </songs>
</cd>
